{
  "schema": "codexy.routing-evaluation-results.v1",
  "corpus_id": "routing-549-v1",
  "selected_effort": "high",
  "results": [
    {
      "task_id": "simple-local-validator",
      "prompt": "Add one mutation test without editing production code.",
      "acceptance_oracle": "The test is faithful and bounded.",
      "model": "gpt-5.6-terra",
      "thinking": "high",
      "acceptance": "pass",
      "p0_p1_misses": 0,
      "proof_complete": true,
      "repairs_retries": 0,
      "tokens": null,
      "wall_time_ms": null,
      "observed_cost_usd": null
    },
    {
      "task_id": "general-routing-contract",
      "prompt": "Map the routing contract and return a minimal proof plan.",
      "acceptance_oracle": "The plan preserves current Terra/high.",
      "model": "gpt-5.6-terra",
      "thinking": "high",
      "acceptance": "pass",
      "p0_p1_misses": 0,
      "proof_complete": true,
      "repairs_retries": 0,
      "tokens": null,
      "wall_time_ms": null,
      "observed_cost_usd": null
    },
    {
      "task_id": "ambiguous-specialist-boundary",
      "prompt": "Classify an ownership-sensitive routing change and select the safe handler.",
      "acceptance_oracle": "The result fails closed without Luna.",
      "model": "gpt-5.6-terra",
      "thinking": "high",
      "acceptance": "pass",
      "p0_p1_misses": 0,
      "proof_complete": true,
      "repairs_retries": 0,
      "tokens": null,
      "wall_time_ms": null,
      "observed_cost_usd": null
    },
    {
      "task_id": "simple-local-validator",
      "prompt": "Add one mutation test without editing production code.",
      "acceptance_oracle": "The test is faithful and bounded.",
      "model": "gpt-5.6-terra",
      "thinking": "xhigh",
      "acceptance": "pass",
      "p0_p1_misses": 0,
      "proof_complete": true,
      "repairs_retries": 0,
      "tokens": null,
      "wall_time_ms": null,
      "observed_cost_usd": null
    },
    {
      "task_id": "general-routing-contract",
      "prompt": "Map the routing contract and return a minimal proof plan.",
      "acceptance_oracle": "The plan preserves current Terra/high.",
      "model": "gpt-5.6-terra",
      "thinking": "xhigh",
      "acceptance": "pass",
      "p0_p1_misses": 0,
      "proof_complete": true,
      "repairs_retries": 0,
      "tokens": null,
      "wall_time_ms": null,
      "observed_cost_usd": null
    },
    {
      "task_id": "ambiguous-specialist-boundary",
      "prompt": "Classify an ownership-sensitive routing change and select the safe handler.",
      "acceptance_oracle": "The result fails closed without Luna.",
      "model": "gpt-5.6-terra",
      "thinking": "xhigh",
      "acceptance": "pass",
      "p0_p1_misses": 0,
      "proof_complete": true,
      "repairs_retries": 0,
      "tokens": null,
      "wall_time_ms": null,
      "observed_cost_usd": null
    },
    {
      "task_id": "simple-local-validator",
      "prompt": "Add one mutation test without editing production code.",
      "acceptance_oracle": "The test is faithful and bounded.",
      "model": "gpt-5.6-terra",
      "thinking": "max",
      "acceptance": "pass",
      "p0_p1_misses": 0,
      "proof_complete": true,
      "repairs_retries": 0,
      "tokens": null,
      "wall_time_ms": null,
      "observed_cost_usd": null
    },
    {
      "task_id": "general-routing-contract",
      "prompt": "Map the routing contract and return a minimal proof plan.",
      "acceptance_oracle": "The plan preserves current Terra/high.",
      "model": "gpt-5.6-terra",
      "thinking": "max",
      "acceptance": "pass",
      "p0_p1_misses": 0,
      "proof_complete": true,
      "repairs_retries": 0,
      "tokens": null,
      "wall_time_ms": null,
      "observed_cost_usd": null
    },
    {
      "task_id": "ambiguous-specialist-boundary",
      "prompt": "Classify an ownership-sensitive routing change and select the safe handler.",
      "acceptance_oracle": "The result fails closed without Luna.",
      "model": "gpt-5.6-terra",
      "thinking": "max",
      "acceptance": "pass",
      "p0_p1_misses": 0,
      "proof_complete": true,
      "repairs_retries": 0,
      "tokens": null,
      "wall_time_ms": null,
      "observed_cost_usd": null
    }
  ]
}
